{
  "schema": "codebox.telemetry/v1",
  "runner": {
    "language": "python",
    "name": "codebox-run-py",
    "sdk": "opentelemetry-python",
    "sdk_version": "1.44.0"
  },
  "run_id": null,
  "box": null,
  "entry": "/workspace/codes/hello.py",
  "command": [
    "/opt/codebox/venv/bin/python",
    "/workspace/codes/hello.py"
  ],
  "compile": null,
  "process": {
    "pid": 2337,
    "exit_code": 0,
    "signal": null,
    "timed_out": false,
    "spawn_error": null,
    "started_at": "2026-09-24T10:27:07.699743+00:00",
    "ended_at": "2026-09-24T10:27:07.782496+00:00",
    "duration_ms": 82.748719
  },
  "resources": {
    "user_cpu_ms": 62.597,
    "system_cpu_ms": 19.531,
    "max_rss_kb": 46864,
    "minor_page_faults": 10663,
    "major_page_faults": 0,
    "voluntary_ctx_switches": 1,
    "involuntary_ctx_switches": 0,
    "fs_in_blocks": 0,
    "fs_out_blocks": 8,
    "threads": null
  },
  "otel": {
    "resource": {
      "telemetry.sdk.language": "python",
      "telemetry.sdk.name": "opentelemetry",
      "telemetry.sdk.version": "1.44.0",
      "service.instance.id": "b3ccd26c-a25b-4a35-92f6-45612edd6a37",
      "service.name": "codebox-local",
      "service.version": "1.0.0",
      "codebox.box": "",
      "codebox.run_id": "",
      "process.runtime.name": "cpython",
      "process.runtime.version": "3.11.15",
      "host.name": "fixture"
    },
    "spans": [
      {
        "name": "process.exec",
        "trace_id": "1162f9208b51757c27780ac7b9e0827d",
        "span_id": "0a4ae452b2fd2efe",
        "parent_span_id": "76e3378ca84520df",
        "kind": "CLIENT",
        "start_time_unix_nano": "1790245627699922709",
        "end_time_unix_nano": "1790245627782401137",
        "duration_ms": 82.478428,
        "status": {
          "code": "OK",
          "message": null
        },
        "attributes": {
          "process.command": "/opt/codebox/venv/bin/python",
          "process.command_args": [
            "/opt/codebox/venv/bin/python",
            "/workspace/codes/hello.py"
          ],
          "process.pid": 2337,
          "process.exit.code": 0
        },
        "events": []
      },
      {
        "name": "codebox.run",
        "trace_id": "1162f9208b51757c27780ac7b9e0827d",
        "span_id": "76e3378ca84520df",
        "parent_span_id": null,
        "kind": "INTERNAL",
        "start_time_unix_nano": "1790245627699862150",
        "end_time_unix_nano": "1790245627782478128",
        "duration_ms": 82.615978,
        "status": {
          "code": "OK",
          "message": null
        },
        "attributes": {
          "code.filepath": "/workspace/codes/hello.py",
          "codebox.language": "python",
          "process.exit.code": 0
        },
        "events": []
      }
    ],
    "metrics": [
      {
        "name": "process.duration",
        "unit": "ms",
        "type": "HISTOGRAM",
        "data_points": [
          {
            "attributes": {
              "code.filepath": "/workspace/codes/hello.py"
            },
            "value": {
              "count": 1,
              "sum": 82.748719,
              "min": 82.748719,
              "max": 82.748719,
              "buckets": {
                "boundaries": [
                  0.0,
                  5.0,
                  10.0,
                  25.0,
                  50.0,
                  75.0,
                  100.0,
                  250.0,
                  500.0,
                  750.0,
                  1000.0,
                  2500.0,
                  5000.0,
                  7500.0,
                  10000.0
                ],
                "counts": [
                  0,
                  0,
                  0,
                  0,
                  0,
                  0,
                  1,
                  0,
                  0,
                  0,
                  0,
                  0,
                  0,
                  0,
                  0,
                  0
                ]
              }
            }
          }
        ]
      },
      {
        "name": "process.cpu.time",
        "unit": "ms",
        "type": "SUM",
        "data_points": [
          {
            "attributes": {
              "code.filepath": "/workspace/codes/hello.py",
              "cpu.mode": "user"
            },
            "value": 62.597
          },
          {
            "attributes": {
              "code.filepath": "/workspace/codes/hello.py",
              "cpu.mode": "system"
            },
            "value": 19.531
          }
        ]
      },
      {
        "name": "process.memory.max_rss",
        "unit": "KiBy",
        "type": "GAUGE",
        "data_points": [
          {
            "attributes": {
              "code.filepath": "/workspace/codes/hello.py"
            },
            "value": 46864
          }
        ]
      },
      {
        "name": "process.paging.faults",
        "unit": "{fault}",
        "type": "SUM",
        "data_points": [
          {
            "attributes": {
              "code.filepath": "/workspace/codes/hello.py",
              "process.paging.fault_type": "minor"
            },
            "value": 10663
          },
          {
            "attributes": {
              "code.filepath": "/workspace/codes/hello.py",
              "process.paging.fault_type": "major"
            },
            "value": 0
          }
        ]
      },
      {
        "name": "process.context_switches",
        "unit": "{count}",
        "type": "SUM",
        "data_points": [
          {
            "attributes": {
              "code.filepath": "/workspace/codes/hello.py",
              "process.context_switch_type": "voluntary"
            },
            "value": 1
          },
          {
            "attributes": {
              "code.filepath": "/workspace/codes/hello.py",
              "process.context_switch_type": "involuntary"
            },
            "value": 0
          }
        ]
      }
    ]
  }
}